{
  "spec_version": "tone_spec_v1",
  "id": "pluck_starlit_pin",
  "name": "Starlit Pin Pluck",
  "source": "xiwu_factory_expansion_2026_04_b",
  "tags": ["pluck", "star", "pin", "factory-expanded"],
  "osc": { "sine": 0.12, "saw": 0.33, "square": 0.12, "triangle": 0.39, "noise": 0.01, "sub_octave": 0.04 },
  "env": { "attack": 0.003, "decay": 0.16, "sustain": 0.15, "release": 0.20 },
  "character": { "drive": 0.12, "brightness": 0.88, "stereo_width": 0.29 },
  "eq4": { "low": 0.12, "low_mid": 0.25, "high_mid": 0.79, "high": 0.94 }
}
