{
  "spec_version": "tone_spec_v1",
  "id": "bass_acid_claw",
  "name": "Acid Claw Bass",
  "source": "xiwu_factory_expansion_2026_04",
  "tags": ["bass", "acid", "aggressive", "factory-expanded"],
  "osc": {
    "sine": 0.22,
    "saw": 0.72,
    "square": 0.39,
    "triangle": 0.08,
    "noise": 0.05,
    "sub_octave": 0.56
  },
  "env": {
    "attack": 0.003,
    "decay": 0.13,
    "sustain": 0.48,
    "release": 0.18
  },
  "character": {
    "drive": 0.62,
    "brightness": 0.58,
    "stereo_width": 0.11
  },
  "eq4": {
    "low": 0.72,
    "low_mid": 0.66,
    "high_mid": 0.48,
    "high": 0.24
  }
}
